{
  "schema_version":1,
  "catalog_version":"1.2-c1",
  "relation_types":["adjacent_to","intersects_with","crosses","penetrates","located_in","located_above","located_below","supported_by","shares_support_with","connected_to","conflicts_with","affects","requires_coordination_with"],
  "rules":[
    {"rule_id":"adjacent-between","relation_type":"adjacent_to","expressions":["贴着","贴到","靠着","挨着","旁边"],"mode":"between","subject_types":["electrical_line","cable","conduit","cable_tray","floor_drain","fire_pipe","sprinkler_pipe"],"object_types":["water_supply_pipe","drainage_pipe","waterproof_layer","ceiling_keel","fire_pipe","sprinkler_pipe"],"max_distance":18,"score":92,"topic_hints":["requires_coordination"]},
    {"rule_id":"cross-two-before","relation_type":"crosses","expressions":["交叉过去","交叉","相交"],"mode":"two_before","subject_types":["electrical_line","cable","conduit","cable_tray","duct","water_supply_pipe","drainage_pipe","fire_pipe","sprinkler_pipe"],"object_types":["electrical_line","cable","conduit","cable_tray","duct","water_supply_pipe","drainage_pipe","fire_pipe","sprinkler_pipe"],"max_distance":24,"score":88,"topic_hints":["mep_coordination"]},
    {"rule_id":"penetrates-between","relation_type":"penetrates","expressions":["穿过","穿墙","贯穿"],"mode":"between","subject_types":["electrical_line","cable","conduit","cable_tray","duct","water_supply_pipe","drainage_pipe","fire_pipe","sprinkler_pipe"],"object_types":["fire_wall","partition_wall","load_bearing_wall","slab"],"max_distance":20,"score":94,"topic_hints":["penetration_firestopping"]},
    {"rule_id":"penetrates-two-before","relation_type":"penetrates","expressions":["穿下去","穿上去","穿楼板"],"mode":"two_before","subject_types":["electrical_line","cable","conduit","cable_tray","duct","water_supply_pipe","drainage_pipe","fire_pipe","sprinkler_pipe"],"object_types":["slab"],"max_distance":24,"score":92,"topic_hints":["penetration_firestopping"]},
    {"rule_id":"opening-between","relation_type":"penetrates","expressions":["开一个门洞","开门洞","开洞"],"mode":"between","subject_types":["load_bearing_wall","partition_wall","beam","slab"],"object_types":["door"],"max_distance":20,"score":90,"topic_hints":["existing_building_alteration","structural_safety"]},
    {"rule_id":"inside-container","relation_type":"located_in","expressions":["吊顶里面","天花里面","吊顶内","天花内"],"mode":"container_before_all","subject_types":["electrical_line","cable","conduit","cable_tray","duct","water_supply_pipe","drainage_pipe","fire_pipe","sprinkler_pipe"],"object_types":["ceiling_concealed_space"],"max_distance":36,"score":90,"topic_hints":["ceiling","mep_coordination"]},
    {"rule_id":"below-two-before","relation_type":"located_below","expressions":["下面交叉","下方交叉"],"mode":"two_before","subject_types":["electrical_line","cable","conduit","cable_tray","duct"],"object_types":["water_supply_pipe","drainage_pipe","fire_pipe","sprinkler_pipe","duct"],"max_distance":24,"score":88,"topic_hints":["mep_coordination"]},
    {"rule_id":"above-two-before","relation_type":"located_above","expressions":["上面交叉","上方交叉"],"mode":"two_before","subject_types":["electrical_line","cable","conduit","cable_tray","duct"],"object_types":["water_supply_pipe","drainage_pipe","fire_pipe","sprinkler_pipe","duct"],"max_distance":24,"score":88,"topic_hints":["mep_coordination"]},
    {"rule_id":"shared-support","relation_type":"shares_support_with","expressions":["共用支架","共架","同一个支架"],"mode":"two_before","subject_types":["electrical_line","cable","conduit","cable_tray","duct","water_supply_pipe","drainage_pipe","fire_pipe","sprinkler_pipe"],"object_types":["electrical_line","cable","conduit","cable_tray","duct","water_supply_pipe","drainage_pipe","fire_pipe","sprinkler_pipe"],"max_distance":30,"score":94,"topic_hints":["support_and_hanger","mep_coordination"]},
    {"rule_id":"pressed-between","relation_type":"affects","expressions":["压着","顶着","挡着"],"mode":"between","subject_types":["electrical_line","cable","conduit","cable_tray","duct","water_supply_pipe","drainage_pipe","fire_pipe","sprinkler_pipe"],"object_types":["ceiling_keel","ceiling","support","door","fire_door"],"max_distance":18,"score":90,"topic_hints":["requires_coordination"]},
    {"rule_id":"connected-between","relation_type":"connected_to","expressions":["连接到","接到","连到"],"mode":"between","subject_types":["electrical_line","cable","conduit","water_supply_pipe","drainage_pipe","fire_pipe","sprinkler_pipe"],"object_types":["distribution_box","water_supply_pipe","drainage_pipe","fire_pipe","sprinkler_pipe","floor_drain"],"max_distance":20,"score":88,"topic_hints":[]}
  ]
}
